{
  "$schema": "http://json-schema.org/draft-07/schema#",
  "type": "object",
  "properties": {
    "id": {
      "type": "string",
      "minLength": 1
    },
    "label": {
      "type": "string"
    },
    "summary": {
      "type": "string"
    },
    "framing": {
      "type": "object",
      "properties": {
        "type": {
          "type": "string",
          "minLength": 1
        },
        "disclaimer": {
          "type": "string"
        }
      },
      "required": [
        "type"
      ],
      "additionalProperties": false
    },
    "experience_dimensions": {
      "maxItems": 20,
      "type": "array",
      "items": {
        "type": "object",
        "properties": {
          "id": {
            "type": "string",
            "minLength": 1
          },
          "weight": {
            "type": "number"
          }
        },
        "required": [
          "id",
          "weight"
        ],
        "additionalProperties": false
      }
    },
    "video_stack": {
      "maxItems": 30,
      "type": "array",
      "items": {
        "type": "object",
        "properties": {
          "id": {
            "type": "string"
          },
          "node": {
            "type": "string"
          },
          "params": {
            "type": "object",
            "propertyNames": {
              "type": "string"
            },
            "additionalProperties": {}
          }
        },
        "required": [
          "node"
        ],
        "additionalProperties": false
      }
    },
    "audio_stack": {
      "type": "object",
      "properties": {
        "enabled": {
          "type": "boolean"
        },
        "input": {
          "type": "string",
          "enum": [
            "synth"
          ]
        },
        "synth": {
          "type": "object",
          "properties": {
            "frequency": {
              "type": "number",
              "minimum": 55,
              "maximum": 440
            },
            "detune": {
              "type": "number",
              "minimum": 0,
              "maximum": 40
            },
            "spread": {
              "type": "number",
              "minimum": 0,
              "maximum": 1
            },
            "waveform": {
              "type": "string",
              "enum": [
                "sine",
                "triangle"
              ]
            },
            "brightness": {
              "type": "number",
              "minimum": 0,
              "maximum": 1
            },
            "swell_interval": {
              "type": "number",
              "minimum": 0,
              "maximum": 30
            }
          },
          "additionalProperties": false
        },
        "master": {
          "type": "object",
          "properties": {
            "volume": {
              "type": "number",
              "minimum": 0,
              "maximum": 1
            }
          },
          "additionalProperties": false
        },
        "chain": {
          "maxItems": 20,
          "type": "array",
          "items": {
            "type": "object",
            "properties": {
              "id": {
                "type": "string"
              },
              "node": {
                "type": "string"
              },
              "params": {
                "type": "object",
                "propertyNames": {
                  "type": "string"
                },
                "additionalProperties": {}
              }
            },
            "required": [
              "node"
            ],
            "additionalProperties": false
          }
        }
      },
      "additionalProperties": false
    },
    "reactive": {
      "type": "object",
      "properties": {
        "analyser_to_params": {
          "type": "array",
          "items": {
            "type": "object",
            "properties": {
              "source": {
                "type": "string",
                "enum": [
                  "rms"
                ]
              },
              "target": {
                "type": "string"
              },
              "scale": {
                "type": "number"
              },
              "offset": {
                "type": "number"
              },
              "smoothing": {
                "type": "object",
                "properties": {
                  "attack": {
                    "type": "number",
                    "minimum": 0
                  },
                  "release": {
                    "type": "number",
                    "minimum": 0
                  }
                },
                "additionalProperties": false
              },
              "clamp": {
                "type": "array",
                "items": [
                  {
                    "type": "number"
                  },
                  {
                    "type": "number"
                  }
                ],
                "additionalItems": false,
                "minItems": 2,
                "maxItems": 2
              }
            },
            "required": [
              "source",
              "target"
            ],
            "additionalProperties": false
          }
        }
      },
      "additionalProperties": false
    },
    "safety": {
      "type": "object",
      "properties": {
        "intensity_default": {
          "type": "number"
        },
        "intensity_max": {
          "type": "number"
        },
        "warnings": {
          "maxItems": 20,
          "type": "array",
          "items": {
            "type": "string"
          }
        },
        "safe_mode_clamps": {
          "type": "object",
          "properties": {
            "max_intensity": {
              "type": "number"
            },
            "max_temporal_feedback": {
              "type": "number"
            },
            "max_chroma": {
              "type": "number"
            },
            "max_contrast": {
              "type": "number"
            },
            "no_strobe": {
              "type": "boolean"
            },
            "max_flash_hz": {
              "type": "number"
            },
            "max_luminance_delta_per_frame": {
              "type": "number"
            },
            "audio_ceiling_dbfs": {
              "type": "number"
            },
            "max_tremolo_rate_hz": {
              "type": "number"
            },
            "max_tremolo_depth": {
              "type": "number"
            },
            "max_noise_level": {
              "type": "number"
            },
            "max_feedback": {
              "type": "number"
            },
            "max_jitter": {
              "type": "number"
            },
            "max_pulse_depth": {
              "type": "number"
            }
          },
          "additionalProperties": {}
        },
        "reduced_motion_policy": {
          "type": "object",
          "properties": {
            "disable_nodes": {
              "type": "array",
              "items": {
                "type": "string"
              }
            },
            "note": {
              "type": "string"
            }
          },
          "additionalProperties": {}
        }
      },
      "required": [
        "intensity_default",
        "intensity_max",
        "warnings",
        "safe_mode_clamps"
      ],
      "additionalProperties": {}
    },
    "ui": {
      "type": "object",
      "properties": {
        "controls": {
          "maxItems": 30,
          "type": "array",
          "items": {
            "type": "object",
            "properties": {
              "id": {
                "type": "string"
              },
              "type": {
                "type": "string",
                "enum": [
                  "slider",
                  "toggle"
                ]
              },
              "label": {
                "type": "string"
              },
              "min": {
                "type": "number"
              },
              "max": {
                "type": "number"
              },
              "step": {
                "type": "number"
              },
              "target": {
                "type": "string"
              }
            },
            "required": [
              "id",
              "type"
            ],
            "additionalProperties": false
          }
        }
      },
      "additionalProperties": false
    },
    "references": {
      "type": "object",
      "properties": {
        "dimensions": {
          "type": "array",
          "items": {
            "type": "string"
          }
        }
      },
      "additionalProperties": false
    }
  },
  "required": [
    "id",
    "label",
    "summary",
    "framing",
    "experience_dimensions",
    "video_stack",
    "safety"
  ],
  "additionalProperties": {},
  "$comment": "Source: tools/docs/gen-docs.ts. Edit the source contracts, then run npm run docs:gen."
}