{
  "id": "adhd",
  "label": "ADHD (Attention Fragmentation / Overload)",
  "summary": "A metaphor of attention shifting and signal competition—gentle focus jitter and layered detail, with strong comfort controls.",
  "framing": {
    "type": "metaphor",
    "disclaimer": "This is a metaphorical overlay for understanding and reflection. It does not diagnose or replicate clinical reality."
  },
  "experience_dimensions": [
    {
      "id": "attention_fragmentation",
      "weight": 0.85
    },
    {
      "id": "sensory_overload",
      "weight": 0.55
    },
    {
      "id": "hyperarousal",
      "weight": 0.35
    }
  ],
  "safety": {
    "intensity_default": 0.34,
    "intensity_max": 0.65,
    "warnings": [
      "If you feel overstimulated, reduce Intensity and enable Safe Mode.",
      "Reduced Motion is recommended for motion sensitivity.",
      "Audio is optional; keep volume low.",
      "Avoid flashing lights or rapid flicker; enable Reduced Motion if sensitive.",
      "Keep volume low; avoid headphones at high volume; you can mute audio at any time."
    ],
    "safe_mode_clamps": {
      "max_intensity": 0.65,
      "max_temporal_feedback": 0.25,
      "max_chroma": 0.12,
      "max_contrast": 0.2,
      "no_strobe": true,
      "max_flash_hz": 3,
      "max_luminance_delta_per_frame": 0.25,
      "audio_ceiling_dbfs": -6,
      "max_tremolo_rate_hz": 4,
      "max_tremolo_depth": 0.15,
      "max_noise_level": 0.08,
      "max_feedback": 0.18,
      "max_jitter": 0.06
    },
    "reduced_motion_policy": {
      "disable_nodes": ["temporal_smear", "feedback_loop", "pulse", "focus_jitter"],
      "note": "Reduced Motion removes time-based feedback/jitter nodes and keeps a calmer static overlay."
    }
  },
  "ui": {
    "controls": [
      {
        "id": "intensity",
        "type": "slider",
        "label": "Intensity",
        "min": 0,
        "max": 1,
        "step": 0.01
      },
      {
        "id": "safe_mode",
        "type": "toggle",
        "label": "Safe Mode"
      },
      {
        "id": "reduced_motion",
        "type": "toggle",
        "label": "Reduced Motion"
      },
      {
        "id": "audio_enabled",
        "type": "toggle",
        "label": "Audio (optional)"
      },
      {
        "id": "jitter",
        "type": "slider",
        "label": "Attention Shifts",
        "min": 0,
        "max": 0.2,
        "step": 0.01,
        "target": "video.focus_jitter.amount"
      },
      {
        "id": "sharpen",
        "type": "slider",
        "label": "Detail Gain",
        "min": 0,
        "max": 0.2,
        "step": 0.01,
        "target": "video.edge_sharpen.amount"
      }
    ]
  },
  "video_stack": [
    {
      "id": "focus",
      "node": "focus_jitter",
      "params": {
        "amount": 0.08,
        "smoothing": 0.92
      }
    },
    {
      "id": "edge",
      "node": "edge_sharpen",
      "params": {
        "amount": 0.08
      }
    },
    {
      "id": "grain",
      "node": "grain",
      "params": {
        "amount": 0.18,
        "scale": 1.2,
        "speed": 0.09
      }
    },
    {
      "id": "overload",
      "node": "interference",
      "params": {
        "amount": 0.09,
        "banding": 0.05,
        "smoothing": 0.9,
        "burst_probability": 0.05,
        "burst_duration_ms": 260,
        "burst_min_gap_ms": 1200
      }
    },
    {
      "id": "grade",
      "node": "color_grade",
      "params": {
        "contrast": 0.08,
        "saturation": -0.02,
        "brightness": 0.01
      }
    }
  ],
  "audio_stack": {
    "enabled": true,
    "input": "synth",
    "master": {
      "volume": 0.2
    },
    "chain": [
      {
        "node": "tremolo",
        "params": {
          "rate": 2.2,
          "depth": 0.09
        }
      },
      {
        "node": "highpass",
        "params": {
          "cutoff": 150,
          "q": 0.7
        }
      },
      {
        "node": "lowpass",
        "params": {
          "cutoff": 8500,
          "q": 0.7
        }
      },
      {
        "node": "noise_bed",
        "params": {
          "level": 0.02,
          "color": "pink"
        }
      },
      {
        "node": "compressor_limiter",
        "params": {
          "threshold": -22,
          "ratio": 4,
          "attack": 0.01,
          "release": 0.22,
          "ceiling": -10
        }
      }
    ]
  },
  "reactive": {
    "analyser_to_params": [
      {
        "source": "rms",
        "target": "video.grain.amount",
        "scale": 0.15,
        "offset": 0,
        "smoothing": {
          "attack": 0.08,
          "release": 0.25
        },
        "clamp": [0, 0.45]
      },
      {
        "source": "rms",
        "target": "video.focus_jitter.amount",
        "scale": 0.1,
        "offset": 0.05,
        "smoothing": {
          "attack": 0.06,
          "release": 0.18
        },
        "clamp": [0, 0.18]
      }
    ]
  },
  "references": {
    "dimensions": [
      "docs/references/dimensions/attention_fragmentation.md",
      "docs/references/dimensions/sensory_overload.md",
      "docs/references/dimensions/hyperarousal.md"
    ]
  }
}
