{
  "id": "dpdr",
  "label": "Depersonalization / derealization experiences",
  "summary": "The world behind glass: a pale veil, soft ripple, slight lag and distance, with a hollow detuned bed in a larger space, offer an artistic interpretation of feeling detached. These experiences vary; there is no single visual or auditory form.",
  "framing": {
    "type": "metaphor",
    "disclaimer": "An adjustable artistic interpretation of selected reported experiences. It does not portray a whole condition, predict an individual experience, or reproduce clinical perception. Visual and audio settings are design choices, not medically validated signals."
  },
  "experience_dimensions": [
    {
      "id": "derealization",
      "weight": 0.8
    },
    {
      "id": "depersonalization",
      "weight": 0.65
    }
  ],
  "safety": {
    "intensity_default": 0.5,
    "intensity_max": 1,
    "warnings": [
      "Start with low intensity and volume; sound is optional.",
      "Use Reduced Motion for a steadier image. Stop Everything is always available."
    ],
    "safe_mode_clamps": {
      "max_intensity": 0.75,
      "max_temporal_feedback": 0.12,
      "max_chroma": 0.1,
      "max_contrast": 0.25,
      "no_strobe": true,
      "max_flash_hz": 3,
      "max_luminance_delta_per_frame": 0.25,
      "audio_ceiling_dbfs": -6,
      "max_tremolo_rate_hz": 4,
      "max_tremolo_depth": 0.15,
      "max_noise_level": 0.08,
      "max_feedback": 0.12,
      "max_jitter": 0.05
    },
    "reduced_motion_policy": {
      "disable_nodes": ["temporal_smear", "feedback_loop", "pulse", "focus_jitter", "glass_veil"],
      "note": "Reduced Motion removes time-based feedback/jitter nodes and keeps a calmer static overlay."
    }
  },
  "ui": {
    "controls": [
      {
        "id": "intensity",
        "type": "slider",
        "label": "Intensity",
        "min": 0,
        "max": 1,
        "step": 0.01
      },
      {
        "id": "safe_mode",
        "type": "toggle",
        "label": "Safe Mode"
      },
      {
        "id": "reduced_motion",
        "type": "toggle",
        "label": "Reduced Motion"
      },
      {
        "id": "audio_enabled",
        "type": "toggle",
        "label": "Audio (optional)"
      },
      {
        "id": "veil",
        "type": "slider",
        "label": "Glass veil",
        "min": 0,
        "max": 1,
        "step": 0.01,
        "target": "video.glass_veil.veil"
      },
      {
        "id": "ripple",
        "type": "slider",
        "label": "Ripple",
        "min": 0,
        "max": 0.06,
        "step": 0.01,
        "target": "video.glass_veil.refraction"
      }
    ]
  },
  "video_stack": [
    {
      "id": "glass",
      "node": "glass_veil",
      "params": {
        "veil": 0.85,
        "feedback": 0.14,
        "refraction": 0.045,
        "chroma": 0.1
      }
    },
    {
      "id": "haze",
      "node": "haze",
      "params": {
        "amount": 0.18
      }
    },
    {
      "id": "grade",
      "node": "color_grade",
      "params": {
        "contrast": -0.12,
        "saturation": -0.3,
        "brightness": 0.04,
        "temperature": 0,
        "tint": 0
      }
    },
    {
      "id": "vignette",
      "node": "vignette",
      "params": {
        "amount": 0.22,
        "softness": 0.9
      }
    }
  ],
  "audio_stack": {
    "enabled": true,
    "input": "synth",
    "synth": {
      "frequency": 146.8,
      "detune": 12,
      "waveform": "triangle",
      "brightness": 0.4,
      "spread": 0.65,
      "swell_interval": 11
    },
    "master": {
      "volume": 0.5
    },
    "chain": [
      {
        "node": "lowpass",
        "params": {
          "cutoff": 1800,
          "q": 0.7
        }
      },
      {
        "node": "reverb",
        "params": {
          "mix": 0.4,
          "decay": 2.6
        }
      },
      {
        "node": "delay",
        "params": {
          "time": 0.3,
          "feedback": 0.2,
          "mix": 0.1
        }
      },
      {
        "node": "compressor_limiter",
        "params": {
          "threshold": -22,
          "ratio": 3,
          "attack": 0.02,
          "release": 0.3,
          "ceiling": -6
        }
      }
    ]
  },
  "reactive": {
    "analyser_to_params": []
  },
  "references": {
    "dimensions": [
      "docs/references/dimensions/derealization.md",
      "docs/references/dimensions/depersonalization.md"
    ]
  }
}
